{
  "$schema": "../src/sink.schema.json",
  "name": "Bootstrap Example - GitHub URL with Version Pinning",
  "description": "Example configuration demonstrating GitHub URL pinning best practices",
  "version": "1.0.0",
  "platforms": [
    {
      "os": "darwin",
      "match": "darwin*",
      "name": "macOS",
      "install_steps": [
        {
          "name": "Verify bootstrap from GitHub",
          "command": "echo 'Loaded from GitHub with version pinning'"
        },
        {
          "name": "Display pinning info",
          "command": "echo 'This config was loaded via: sink bootstrap https://raw.githubusercontent.com/org/repo/v1.0.0/config.json'"
        }
      ]
    }
  ]
}
